{
  "format": "tomato-todo-plan",
  "version": 5,
  "pomodoroMinutes": 25,
  "projects": [
    {
      "id": "example-self-study",
      "name": "自主学习",
      "color": "#849b7d",
      "appWhitelist": [
        "org.mozilla.firefox",
        "example.dictionary"
      ]
    }
  ],
  "tasks": [
    {
      "id": "example-self-study-chapter-1",
      "title": "完成一章练习并复盘",
      "notes": "先独立练习，再核对答案和记录错因。日期可按自己的安排填写。",
      "projectId": "example-self-study",
      "dueDate": null,
      "priority": 2,
      "estimate": 2,
      "tags": [
        "练习"
      ],
      "subtasks": [
        {
          "id": "attempt",
          "title": "先独立完成练习"
        },
        {
          "id": "review",
          "title": "记录错因并复述方法"
        }
      ],
      "templateId": "example-practice-template",
      "scrapMinutes": 30,
      "recurring": false
    }
  ],
  "templates": [
    {
      "id": "example-practice-template",
      "shape": {
        "title": "完成一章练习并复盘",
        "notes": "先独立练习，再核对答案和记录错因。日期可按自己的安排填写。",
        "projectId": "example-self-study",
        "priority": 2,
        "estimate": 2,
        "tags": [
          "练习"
        ],
        "subtasks": [
          {
            "id": "attempt",
            "title": "先独立完成练习"
          },
          {
            "id": "review",
            "title": "记录错因并复述方法"
          }
        ],
        "scrapMinutes": 30
      },
      "printing": {
        "kind": "once",
        "date": null,
        "time": null
      },
      "automatic": false,
      "printAheadDays": 7
    }
  ],
  "prints": [
    {
      "templateId": "example-practice-template",
      "date": null
    }
  ],
  "blocks": [
    {
      "id": "example-lecture",
      "title": "专业必修课",
      "days": [
        1,
        3
      ],
      "start": "09:55",
      "end": "11:20",
      "attention": "required",
      "notes": "要签到，课上不要排任务"
    },
    {
      "id": "example-elective",
      "title": "通识选修（水课）",
      "days": [
        2
      ],
      "start": "09:55",
      "end": "11:20",
      "attention": "light",
      "notes": "可以写作业"
    }
  ],
  "goals": [],
  "habits": []
}
